Book Title,Price
"The Coming Woman: A Novel Based on the Life of the Infamous Feminist, Victoria Woodhull",£17.93
The Boys in the Boat: Nine Americans and Their Epic Quest for Gold at the 1936 Berlin Olympics,£22.60
"Starving Hearts (Triangular Trade Trilogy, #1)",£13.99
America's Cradle of Quarterbacks: Western Pennsylvania's Football Factory from Johnny Unitas to Joe Montana,£22.50
Aladdin and His Wonderful Lamp,£53.13
Penny Maybe,£33.29
Maude (1883-1993):She Grew Up with the country,£18.02
"The Inefficiency Assassin: Time Management Tactics for Working Smarter, Not Longer",£20.59
Soul Reader,£39.58
Bossypants,£49.46
A World of Flavor: Your Gluten Free Passport,£42.95
"A Piece of Sky, a Grain of Rice: A Memoir in Four Meditations",£56.76
Tracing Numbers on a Train,£41.60
Thirteen Reasons Why,£52.72
The Secret (The Secret #1),£27.37
The Psychopath Test: A Journey Through the Madness Industry,£36.00
The Kite Runner,£41.82
The Girl on the Train,£55.02
The Emerald Mystery,£23.15
The Bridge to Consciousness: I'm Writing the Bridge Between Science and Our Old and New Beliefs.,£32.00
The Art of War,£33.34
Secrets and Lace (Fatal Hearts #1),£20.27
Romero and Juliet: A Tragic Tale of Love and Zombies,£36.94
Poses for Artists Volume 1 - Dynamic and Sitting Poses: An Essential Reference for Figure Drawing and the Human Form,£41.06
Miss Peregrine’s Home for Peculiar Children (Miss Peregrine’s Peculiar Children #1),£10.76
Large Print Heart of the Pride,£19.15
Grumbles,£22.16
First Steps for New Christians (Print Edition),£29.00
Eureka Trivia 6.0,£54.59
Drive: The Surprising Truth About What Motivates Us,£34.95
Done Rubbed Out (Reightman & Bailey #1),£37.72
Beauty Restored (Riley Family Legacy Novellas #3),£11.11
Ayumi's Violin,£15.48
Anonymous,£46.82
Amy Meets the Saints and Sages,£18.46
Amatus,£50.54
V for Vendetta (V for Vendetta Complete),£37.10
"Unbroken: A World War II Story of Survival, Resilience, and Redemption",£45.95
The Wright Brothers,£56.80
The Songs of the Gods,£44.48
The Rosie Project (Don Tillman #1),£54.04
The Power of Habit: Why We Do What We Do in Life and Business,£16.88
Steve Jobs,£39.50
Luckiest Girl Alive,£49.83
"Living Leadership by Insight: A Good Leader Achieves, a Great Leader Builds Monuments",£46.91
Lady Midnight (The Dark Artifices #1),£16.28
"Hush, Hush (Hush, Hush #1)",£47.02
Greek Mythic History,£10.23
Every Last Word,£46.47
Daily Fantasy Sports,£36.58
Clockwork Angel (The Infernal Devices #1),£44.14
City of Fallen Angels (The Mortal Instruments #4),£11.23
City of Bones (The Mortal Instruments #1),£43.28
City of Ashes (The Mortal Instruments #2),£47.27
"Carry On, Warrior: Thoughts on Life Unarmed",£31.85
Carrie,£46.23
Angels & Demons (Robert Langdon #1),£51.48
"The Three Searches, Meaning, and the Story",£13.33
Raspberry Pi Electronics Projects for the Evil Genius,£49.67
How to Speak Golf: An Illustrated Guide to Links Lingo,£58.32
Eleanor & Park,£56.51
Troublemaker: Surviving Hollywood and Scientology,£48.39
Adultery,£20.88
Unlimited Intuition Now,£58.87
Underlying Notes,£11.82
The New Brand You: Your New Image Makes the Sale for You,£44.05
The Flowers Lied,£16.68
"NaNo What Now? Finding your editing process, revising your NaNoWriMo book and building a writing career through publishing and beyond",£10.41
Modern Day Fables,£47.44
The Unlikely Pilgrimage of Harold Fry (Harold Fry #1),£43.62
The Martian (The Martian #1),£41.39
Left Behind (Left Behind #1),£40.72
John Vassos: Industrial Design for Modern Life,£20.22
I'll Give You the Sun,£56.48
Heaven is for Real: A Little Boy's Astounding Story of His Trip to Heaven and Back,£52.86
Ender's Game (The Ender Quintet #1),£43.64
Death by Leisure: A Cautionary Tale,£37.51
Wildlife of New York: A Five-Borough Coloring Book,£22.14
The Year of Living Biblically: One Man's Humble Quest to Follow the Bible as Literally as Possible,£34.72
The Great Gatsby,£36.05
The Good Girl,£49.03
The 7 Habits of Highly Effective People: Powerful Lessons in Personal Change,£33.17
Steal Like an Artist: 10 Things Nobody Told You About Being Creative,£20.90
Life of Pi,£13.22
The Sound Of Love,£57.84
The Perks of Being a Wallflower,£55.02
The Makings of a Fatherless Child,£31.58
The Hobbit (Middle-Earth Universe),£17.80
The Fellowship of the Ring (The Lord of the Rings #1),£10.27
Ship Leaves Harbor: Essays on Travel by a Recovering Journeyman,£30.60
Musicophilia: Tales of Music and the Brain,£46.58
What If?: Serious Scientific Answers to Absurd Hypothetical Questions,£53.68
The Fault in Our Stars,£47.22
The Dream Thieves (The Raven Cycle #2),£34.50
The 5th Wave (The 5th Wave #1),£11.83
Shiver (The Wolves of Mercy Falls #1),£16.23
Remember Me?,£11.48
If I Stay (If I Stay #1),£38.13
I Know Why the Caged Bird Sings (Maya Angelou's Autobiography #1),£36.55
Harry Potter and the Deathly Hallows (Harry Potter #7),£23.32
Fool Me Once,£16.96
Drama,£38.70
"Blue Lily, Lily Blue (The Raven Cycle #3)",£34.13
Alight (The Generations Trilogy #2),£58.59
Vogue Colors A to Z: A Fashion Coloring Book,£52.35
The Shining (The Shining #1),£27.88
The Hunger Games (The Hunger Games #1),£29.85
Outlander (Outlander #1),£19.67
Mockingjay (The Hunger Games #3),£20.44
Harry Potter and the Sorcerer's Stone (Harry Potter #1),£13.90
Confessions of a Shopaholic (Shopaholic #1),£48.94
Zero History (Blue Ant #3),£34.77
World War Z: An Oral History of the Zombie War,£21.80
Wild: From Lost to Found on the Pacific Crest Trail,£46.02
"Where'd You Go, Bernadette",£18.13
Twilight (Twilight #1),£41.93
The Paris Wife,£36.80
The Maze Runner (The Maze Runner #1),£20.93
The Lover's Dictionary,£58.09
The Goldfinch,£43.58
The Giver (The Giver Quartet #1),£12.30
The Girl Who Played with Fire (Millennium Trilogy #2),£22.14
The Demon-Haunted World: Science as a Candle in the Dark,£52.25
The Book Thief,£53.49
The Autobiography of Malcolm X,£23.43
Shopaholic & Baby (Shopaholic #5),£46.45
Quiet: The Power of Introverts in a World That Can't Stop Talking,£43.55
Packing for Mars: The Curious Science of Life in the Void,£56.68
Orange Is the New Black,£24.61
One for the Money (Stephanie Plum #1),£32.87
Morning Star (Red Rising #3),£29.40
Life After Life,£26.13
"Lean In: Women, Work, and the Will to Lead",£25.02
Is Everyone Hanging Out Without Me? (And Other Concerns),£20.11
Gone Girl,£37.60
Fellside,£38.62
Eclipse (Twilight #3),£18.74
Dracula,£52.62
Dead Wake: The Last Crossing of the Lusitania,£39.24
"David and Goliath: Underdogs, Misfits, and the Art of Battling Giants",£17.81
Dark Places,£23.90
Breaking Dawn (Twilight #4),£35.28
Beautiful Creatures (Caster Chronicles #1),£21.55
A Visit from the Goon Squad,£14.08
The Zombie Room,£19.69
The Name of the Wind (The Kingkiller Chronicle #1),£50.59
Taking Shots (Assassins #1),£18.88
Shatter Me (Shatter Me #1),£42.40
Paradise Lost (Paradise #1),£24.96
On the Road (Duluoz Legend),£32.36
Jane Eyre,£38.43
Frankenstein,£38.00
